### ISSUE TITLE
moco: server_check: expected 0x4f4b ('OK') got 726f

### ISSUE THREAD

**Issue by petarb** [badzong/mopher#14]
A high-volume mailing-list that delivers each of its messages with a unique envelope-sender inflated my counter_penpal and when I'm trying to dump it, moco fails:

```
# moco table -D counter_penpal
server_check: expected 0x4f4b ('OK') got 726f
server_data_cmd: server_check failed
moco_table_dump: server_data_cmd failed
```

Here is a quick tcpdump:

```
# tcpdump -ilo0 -s0 -A tcp port 44554
tcpdump: verbose output suppressed, use -v or -vv for full protocol decode
listening on lo0, link-type NULL (BSD loopback), capture size 65535 bytes
12:46:13.215990 IP 127.0.0.1.63455 > 127.0.0.1.44554: Flags [S], seq 830018289, win 32768, options [mss 33608,nop,wscale 3,sackOK,nop,nop,nop,nop,TS val 1 ecr 0], length 0
E..@..@.@..............
1y..........P......H...........
........
12:46:13.216027 IP 127.0.0.1.44554 > 127.0.0.1.63455: Flags [S.], seq 853713292, ack 830018290, win 32768, options [mss 33608,nop,wscale 3,nop,nop,TS val 1 ecr 1,sackOK,nop,nop], length 0
E..@..@.@............
..2...1y......{......H.......
............
12:46:13.216041 IP 127.0.0.1.63455 > 127.0.0.1.44554: Flags [.], ack 1, win 4096, options [nop,nop,TS val 1 ecr 1], length 0
E..4..@.@..............
1y..2..............
........
12:46:13.216103 IP 127.0.0.1.63455 > 127.0.0.1.44554: Flags [P.], seq 1:27, ack 1, win 4096, options [nop,nop,TS val 1 ecr 1], length 26
E..N.A@.@..............
1y..2..............
........table_dump counter_penpal

12:46:13.221216 IP 127.0.0.1.44554 > 127.0.0.1.63455: Flags [P.], seq 1:7, ack 27, win 4096, options [nop,nop,TS val 1 ecr 1], length 6
E..:..@.@............
..2...1y.......W.....
........82585

12:46:13.221254 IP 127.0.0.1.63455 > 127.0.0.1.44554: Flags [P.], seq 27:29, ack 7, win 4096, options [nop,nop,TS val 1 ecr 1], length 2
E..6..@.@..............
1y..2.......Z~.....
........OK
12:46:13.221314 IP 127.0.0.1.44554 > 127.0.0.1.63455: Flags [P.], seq 7:16391, ack 29, win 4096, options [nop,nop,TS val 1 ecr 1], length 16384
E.@4.B@.@............
..2...1y.............
........(<LIST-ITEM-REMOVED>)
(<LIST-ITEM-REMOVED>)
(<LIST-ITEM-REMOVED>)
(<LIST-ITEM-REMOVED>)
(<LIST-ITEM-REMOVED>)
(<LIST-ITEM-REMOVED>)
(<LIST-ITEM-REMOVED>)
(<LIST-ITEM-REMOVED>)
(<LIST-ITEM-REMOVED>)
(<LIST-ITEM-REMOVED>)
(<LIST-ITEM-REMOVED>)
(<LIST-ITEM-REMOVED>)
(<LIST-ITEM-REMOVED>)
(<LIST-ITEM-REMOVED>)
(<LIST-ITEM-REMOVED>)
(<LIST-ITEM-REMOVED>)
(<LIST-ITEM-REMOVED>)
(<LIST-ITEM-REMOVED>)
(<LIST-ITEM-REMOVED>)
(<LIST-ITEM-REMOVED>)
(<LIST-ITEM-REMOVED>)
(<LIST-ITEM-REMOVED>)
(<LIST-ITEM-REMOVED>)
(<LIST-ITEM-REMOVED>)
(<LIST-ITEM-REMOVED>)
(<LIST-ITEM-REMOVED>)
(<LIST-ITEM-REMOVED>)
(<LIST-ITEM-REMOVED>)
(<LIST-ITEM-REMOVED>)
(<LIST-ITEM-REMOVED>)
(<LIST-ITEM-REMOVED>)
(<LIST-ITEM-REMOVED>)
(<LIST-ITEM-REMOVED>)
(<LIST-ITEM-REMOVED>)
(<LIST-ITEM-REMOVED>)
(<LIST-ITEM-REMOVED>)
(<LIST-ITEM-REMOVED>)
(<LIST-ITEM-REMOVED>)
(<LIST-ITEM-REMOVED>)
(<LIST-ITEM-REMOVED>)
(<LIST-ITEM-REMOVED>)
(<LIST-ITEM-REMOVED>)
(<LIST-ITEM-REMOVED>)
(<LIST-ITEM-REMOVED>)
(<LIST-ITEM-REMOVED>)
(<LIST-ITEM-REMOVED>)
(<LIST-ITEM-REMOVED>)
(<LIST-ITEM-REMOVED>)
(<LIST-ITEM-REMOVED>)
(google.com,list+bncBC253GND24JRB3NKR6QAKGQETIBAOIY@googlegroups.com,foo@bar.com,1409537396,1409537396,1410142196,1)
(google.com,list+bncBC253GND24JRB5E2SGQAKGQER3GSH5Q@googlegroups.com,foo@bar.com,1409568128,1409568128,1410172928,1)
(google.com,list+bncBC253GND24JRB5PL6WPQKGQESCLNYYY@googlegroups.com,foo@bar.com,1409119743,1409119743,1409724543,1)
(...many more...)
(google.com,list+bncBCA4DV7Z24DRBQMNSCQAKGQERZUOR6Q@googlegroups.com,foo@bar.com,1409550030,1409550030,1410154830,1)
(google.com,list+bncBCA4DV7Z24DRBREG6KPQKGQE2DB2AII@googlegroups.com,foo@bar.com,1409057614,1409057614,1409662414,1)
(google.com,list+bncBCA4DV7Z24DRBRGBSWQAKGQEP4XW3HA@googlegroups.com,foo@bar.com,1409638606,1409638606,1410243406,1)
(google.com,list+bncBCA4DV7Z24DRBSPZ6WPQKGQ
12:46:13.221368 IP 127.0.0.1.44554 > 127.0.0.1.63455: Flags [P.], seq 16391:32775, ack 29, win 4096, options [nop,nop,TS val 1 ecr 1], length 16384
E.@4.C@.@............
..2...1y......IJ.....
........EMOCKP3Y@googlegroups.com,foo@bar.com,1409121488,1409121488,1409726288,1)
(google.com,list+bncBCA4DV7Z24DRBT5GSCQAKGQEGYA7XLA@googlegroups.com,foo@bar.com,1409553238,1409553238,1410158038,1)
(google.com,list+bncBCA4DV7Z24DRBTMO7OPQKGQE252U5UI@googlegroups.com,foo@bar.com,1409206100,1409206100,1409810900,1)
(google.com,list+bncBCA4DV7Z24DRBTPI7SPQKGQEODAZCEI@googlegroups.com,foo@bar.com,1409234010,1409234010,1409838810,1)
(...many more...)
(google.com,list+bncBCN2RUNNSACRBPOFSKQAKGQEZRCWCGI@googlegroups.com,foo@bar.com,1409589957,1409589957,1410194757,1)
(google.com,list+bncBCNMZHUWX4ARBEFY6KPQKGQEESVE6EI@googlegroups.com,foo@bar.com,1409063966,1409063966,1409668766,1)
(google.com,list+bncBCNMZHUWX4ARBLMY6KPQKGQEWNF4XNY@googlegroups.com,foo@bar.com,1409059895,1409059895,1409664695,1)
(google.com,list+bncBCO2BL6QRADBBH4CQSQAKGQE6VIMALQ@googleg
12:46:13.221386 IP 127.0.0.1.63455 > 127.0.0.1.44554: Flags [.], ack 32775, win 0, options [nop,nop,TS val 1 ecr 1], length 0
E..4..@.@..............
1y..2.!.....9......
........
12:46:13.221439 IP 127.0.0.1.63455 > 127.0.0.1.44554: Flags [.], ack 32775, win 4096, options [nop,nop,TS val 1 ecr 1], length 0
E..4..@.@..............
1y..2.!.....)......
........
12:46:13.221473 IP 127.0.0.1.44554 > 127.0.0.1.63455: Flags [.], seq 32775:53255, ack 29, win 4096, options [nop,nop,TS val 1 ecr 1], length 20480
E.P4.D@.@............
..2.!.1y......A......
........roups.com,foo@bar.com,1409351976,1409351976,1409956776,1)
(google.com,list+bncBCO2BL6QRADBBOFUQGQAKGQEG5EUYBI@googlegroups.com,foo@bar.com,1409309250,1409309250,1409914050,1)
(google.com,list+bncBCOIX3HO6QJRBEFY7OPQKGQERUCUL6I@googlegroups.com,foo@bar.com,1409211417,1409211417,1409816217,1)
(google.com,list+bncBCOIX3HO6QJRBXVU7KPQKGQEP4P3H3I@googlegroups.com,foo@bar.com,1409194607,1409194607,1409799407,1)
(...many more...)
(google.com,list+bncBDFP3WV74ALBBS467SPQKGQEE7BWIVQ@googlegroups.com,foo@bar.com,1409224532,1409224532,1409829332,1)
(google.com,list+bncBDG4HK677EPBB7UDRKQAKGQE6X6TELA@googlegroups.com,foo@bar.com,1409450502,1409450502,1410055302,1)
(google.com,list+bncBDI2VAOFZYGBBOECQOQAKGQEJ7SP5VQ@googlegroups.com,foo@bar.com,1409335617,1409335617,1409940417,1)
(google.com,list+bncBDI4HQHRYAGRBL6GQSQAKGQE3SA2R5Y@googlegroups.com,foo@bar.com,140
12:46:13.221867 IP 127.0.0.1.63455 > 127.0.0.1.44554: Flags [F.], seq 29, ack 53255, win 4096, options [nop,nop,TS val 1 ecr 1], length 0
E..4..@.@..............
1y..2.q............
........
12:46:13.221915 IP 127.0.0.1.44554 > 127.0.0.1.63455: Flags [P.], seq 53255:73735, ack 30, win 4096, options [nop,nop,TS val 1 ecr 1], length 20480
E.P4.K@.@............
..2.q.1y.......;.....
........9360696,1409360696,1409965496,1)
(google.com,list+bncBDJPNZMO74NBBTG4SOQAKGQE27AOHWA@googlegroups.com,foo@bar.com,1409609301,1409609301,1410214101,1)
(google.com,list+bncBDJYD2ORTIERB2NMQKQAKGQEEZN7NWQ@googlegroups.com,foo@bar.com,1409324657,1409324657,1409929457,1)
(google.com,list+bncBDJYD2ORTIERB6O7QOQAKGQEIE3T25Y@googlegroups.com,foo@bar.com,1409347585,1409347585,1409952385,1)
(...many more...)
(google.com,list+bncBDZ25HFW6ALBBLPCQSQAKGQEIJ7A6PY@googlegroups.com,foo@bar.com,1409364281,1409364281,1409969081,1)
(google.com,list+bncBDZ25HFW6ALBBNPXSSQAKGQEM4DUZ2Y@googlegroups.com,foo@bar.com,1409629120,1409629120,1410233920,1)
(google.com,list+bncBDZ25HFW6ALBBOHM7GPQKGQETZ56DEQ@googlegroups.com,foo@bar.com,1409185352,1409185352,1409790152,1)
(google.com,list+bncBDZ25HFW6
12:46:13.221940 IP 127.0.0.1.63455 > 127.0.0.1.44554: Flags [R], seq 830018319, win 0, length 0
E..(....@..............
1y......P....k..
```
